{
 "brief_id": "b-p-bpd-001",
 "product_id": "p-bpd-001",
 "type_id": "business-planner-digital",
 "line": "planner",
 "created_at": "2026-10-23T12:00:00Z",
 "positioning": "For people who run a business on their own (makers, Etsy and online sellers, service providers) who want one linked 2027 planner instead of a generic diary plus loose templates. It wins by pairing a full dated calendar with the three business pages solo owners use every month (Money month, content slots, Year plan) and by working the first time, with a Start here page, a Setup check and a head start that begins this week.",
 "must_haves": [
  {
   "id": "mh_business",
   "what": "Built for running a business, not a general life planner: every week page has Content to post and Follow up, every day page has Calls and emails and Orders to send, plus Year plan, Price check, Business routines and Money month pages.",
   "evidence": [
    "feature:work",
    "praise:p_fits_needs",
    "keyword:business planner",
    "keyword:small business"
   ]
  },
  {
   "id": "mh_calendar",
   "what": "Full dated 2027 calendar: year, 12 months, 52 weeks and 365 day pages, every date, tab and trail linked, so it replaces a diary as well as the business templates.",
   "evidence": [
    "feature:dated",
    "praise:p_complete",
    "keyword:digital planner",
    "keyword:2026 digital planner"
   ]
  },
  {
   "id": "mh_apps",
   "what": "One hyperlinked PDF that works in Goodnotes, Notability, Noteshelf, Samsung Notes, Xodo and Adobe Acrobat Reader; the listing names these apps and says no subscription is needed.",
   "evidence": [
    "feature:goodnotes",
    "feature:notability",
    "feature:android",
    "keyword:goodnotes planner",
    "keyword:ipad planner",
    "wish:w_listing_info"
   ]
  },
  {
   "id": "mh_look",
   "what": "Calm, uncluttered pages with clear hierarchy and plenty of writing room; two font families only, sharp vector text at any zoom.",
   "evidence": [
    "praise:p_look",
    "praise:p_quality",
    "praise:p_space"
   ]
  },
  {
   "id": "mh_easy",
   "what": "Easy to start and the same layout every week: Start here page with four steps, Setup check, Contents with every section and month.",
   "evidence": [
    "praise:p_easy",
    "praise:p_guide",
    "praise:p_as_described"
   ]
  },
  {
   "id": "mh_content",
   "what": "Content planning built into the calendar (Launches and content on every month page, Content to post on every week page, Content ideas pages), because social media and content planners are a large share of what this market sells.",
   "evidence": [
    "keyword:social media planner",
    "keyword:content planner",
    "keyword:content calendar",
    "listing:1774093834"
   ]
  }
 ],
 "fixes": [
  {
   "id": "fx_not_useful",
   "complaint": "complaint:c_not_useful",
   "how": "Aimed at one clear buyer, the one-person business, with pages for what that buyer does every week: Money month (money in by source, money out by cost type, profit, orders, best seller), Price check (cost, fees, time, price, profit per product), Content to post and Follow up on every week page. The listing's first lines say who it is for and what it is not (not a business plan workbook, not a printable, not made to order), so buyers with other needs do not buy it.",
   "evidence": [
    "complaint:c_not_useful",
    "complaint:c_basic",
    "keyword:small business owner",
    "keyword:etsy shop planner"
   ],
   "modules": [
    "money_month",
    "table",
    "calendar"
   ]
  },
  {
   "id": "fx_misleading",
   "complaint": "complaint:c_misleading",
   "how": "Listing copy states the exact page count and file size of the built file (r003), what each page type is and how many there are (52 week pages, 365 day pages, 12 Money months, and so on), that it is one landscape PDF, dated Oct 26, 2026 to Dec 2027, Monday start. No page is counted twice. Photo ph10 shows the Contents page so the buyer sees every section before buying.",
   "evidence": [
    "complaint:c_misleading",
    "complaint:c_missing",
    "complaint:c_repetitive",
    "praise:p_as_described"
   ],
   "modules": [
    "index"
   ]
  },
  {
   "id": "fx_download",
   "complaint": "complaint:c_download",
   "how": "One PDF delivered as a direct Etsy download (no zip, no outside link, no sign-up). The listing's first FAQ line and step 1 of the Start here page say: download in a web browser, not the Etsy app, then open the PDF in a named app. File size is stated in the listing so buyers on slow connections know what to expect.",
   "evidence": [
    "complaint:c_download",
    "complaint:c_delivery_delay",
    "wish:w_easy_delivery",
    "complaint:c_upsell"
   ],
   "modules": [
    "guide"
   ]
  },
  {
   "id": "fx_basic",
   "complaint": "complaint:c_basic",
   "how": "Business depth on top of the calendar: Money month for each month (plus Nov and Dec 2026), a Year plan with quarter tick boxes, Price check, Business routines (daily, weekly, monthly, quarterly), a business habit tracker for every month, and content slots on month and week pages. Photos ph3 and ph5 show these pages close up.",
   "evidence": [
    "complaint:c_basic",
    "wish:w_page_types",
    "feature:budget",
    "feature:goals"
   ],
   "modules": [
    "money_month",
    "table",
    "checklist",
    "calendar"
   ]
  },
  {
   "id": "fx_value",
   "complaint": "complaint:c_value",
   "how": "A complete working year, not a few templates: about 480 linked pages (exact count from the build in the listing) covering Oct 26, 2026 to Dec 31, 2027, with business pages that a spreadsheet does not give you in one place (week plan, content, follow ups and month money side by side). Every link is tested by the build (r001) so nothing in the price is broken.",
   "evidence": [
    "complaint:c_value",
    "complaint:c_links",
    "praise:p_value",
    "praise:p_complete"
   ],
   "modules": [
    "calendar",
    "head_start",
    "money_month"
   ]
  },
  {
   "id": "fx_quality",
   "complaint": "complaint:c_quality",
   "how": "Vector PDF: all text and lines are drawn as vectors with embedded OFL fonts, so pages stay sharp at any zoom (no blurry raster pages). Pages are 1024 x 768 (iPad landscape) with every element inside the page margins, checked by the build's overflow check. Photo ph10 includes a zoomed crop of small text to show it is sharp. The listing says the pages are sized for a screen, not for letter or A4 paper.",
   "evidence": [
    "complaint:c_quality",
    "complaint:c_print",
    "praise:p_quality"
   ],
   "modules": [
    "cover"
   ]
  },
  {
   "id": "fx_edit",
   "complaint": "complaint:c_edit",
   "how": "Start here step 3 says how to type: every line and table row is tall enough for the app's text box tool (Goodnotes, Notability, Xodo, Acrobat Reader), so keyboard users can type on any page; table rows are 30 px or more. The listing says plainly: write with a stylus or type with your app's text tool; there are no fill-in form fields and it is not a Word or Canva template.",
   "evidence": [
    "complaint:c_edit",
    "wish:w_typeable",
    "wish:w_customize"
   ],
   "modules": [
    "guide",
    "table"
   ]
  },
  {
   "id": "fx_hard",
   "complaint": "complaint:c_hard",
   "how": "Two habits run the planner: the week page every Monday and the Money month at month end (the Start here tip says so). The Start here page gives four numbered steps; the Setup check confirms links before planning; the same week and day layout repeats all year so there is nothing new to learn after week one. Photo ph7 shows the Start here and Setup check pages.",
   "evidence": [
    "complaint:c_hard",
    "complaint:c_setup",
    "complaint:c_overwhelm",
    "praise:p_easy"
   ],
   "modules": [
    "guide",
    "link_test"
   ]
  },
  {
   "id": "fx_support",
   "complaint": "complaint:c_support",
   "how": "Help is printed in the file, so a buyer does not have to wait for a reply: the Setup check page lists the four fixes for links that do not jump, and the Start here page covers download, apps, writing and typing. The listing has the same answers as an FAQ. No reply-time promises anywhere (r007); the buyer is told they can send the shop an Etsy message.",
   "evidence": [
    "complaint:c_support",
    "praise:p_support",
    "complaint:c_broken"
   ],
   "modules": [
    "link_test",
    "guide"
   ]
  },
  {
   "id": "fx_nav",
   "complaint": "complaint:c_nav",
   "how": "Every page has the top bar (Home, Year, Goals, Prices, Content, Notes, Money) and the month tabs on the right edge; calendar pages show a tappable Year / Month / Week trail; the Contents page has a card for every section and all months; the Start here page maps the top bar. No scrolling: every page is reachable in two taps from Contents (r001).",
   "evidence": [
    "complaint:c_nav",
    "complaint:c_links",
    "wish:w_order",
    "wish:w_separate_pages",
    "feature:hyperlinked"
   ],
   "modules": [
    "index",
    "guide",
    "calendar"
   ]
  },
  {
   "id": "fx_device",
   "complaint": "complaint:c_device",
   "how": "The listing has a Works with line naming the apps by device (iPad: Goodnotes, Notability, Noteshelf; Android: Samsung Notes, Xodo; Chromebook, Windows and Mac: Xodo or Adobe Acrobat Reader) and says it needs no Microsoft Word and no subscription. Landscape pages fit laptop screens as well as tablets. Start here step 1 repeats the app list.",
   "evidence": [
    "complaint:c_device",
    "complaint:c_extra_app",
    "wish:w_listing_info",
    "feature:android"
   ],
   "modules": [
    "guide"
   ]
  }
 ],
 "unique": [
  {
   "id": "u_money_month",
   "name": "Money month",
   "what": "A one-page money check for every month of 2027 plus Nov and Dec 2026, linked from each month page: money in by source and money out by cost type (planned and actual), totals and profit, orders or clients, best seller, what worked and one change for next month.",